{
  "schemaVersion": "0.1.0",
  "game": "Arknights: Endfield",
  "categoriesRef": "./categories.json",
  "setCategoriesRef": "./set-categories.json",
  "optionCategoriesRef": "./option-categories.json",
  "sources": [
    {
      "id": "namu-equipment-main",
      "title": "명일방주: 엔드필드/장비",
      "url": "https://namu.wiki/w/%EB%AA%85%EC%9D%BC%EB%B0%A9%EC%A3%BC:%20%EC%97%94%EB%93%9C%ED%95%84%EB%93%9C/%EC%9E%A5%EB%B9%84",
      "type": "wiki",
      "language": "ko",
      "lastCheckedAt": "2026-06-10",
      "notes": "장비 개요, 세트 효과, 장비별 방어력/옵션/단조 수치를 1차 출처로 정리."
    }
  ],
  "equipment": [
    {
      "id": "equipment-001-exy2q8",
      "sortOrder": 1,
      "names": {
        "ko": "고검의 잔향 단검"
      },
      "group": "set",
      "setCategoryId": "equipment-set-001-uwb8is",
      "setOrder": 1,
      "sourceSection": "3.1.1",
      "sourceSectionTitleKo": "고검의 잔향",
      "level": 70,
      "rarity": 5,
      "partId": "kit",
      "partLabelKo": "부품",
      "defense": {
        "statKo": "방어력",
        "value": "+21"
      },
      "options": [
        {
          "slot": 1,
          "categoryId": "equipment-option-001-1wxt4yj"
        },
        {
          "slot": 2,
          "categoryId": "equipment-option-002-1vl73on"
        },
        {
          "slot": 3,
          "categoryId": "equipment-option-003-1n541rj"
        }
      ],
      "forgeable": true,
      "crafting": {
        "materialPartCategoryId": null,
        "sourceStatus": "placeholder",
        "notes": "소모량은 원문에서 확인되지 않아 부품 카테고리 row만 생성함."
      },
      "sourceRefs": [
        "namu-equipment-main"
      ],
      "verification": {
        "status": "needs_review",
        "notes": "원문에서 일차 수집한 값. 추후 인게임/공식 데이터로 교차 검수 필요."
      }
    },
    {
      "id": "equipment-002-2p8zx3",
      "sortOrder": 2,
      "names": {
        "ko": "고검의 잔향 단검 · I"
      },
      "group": "set",
      "setCategoryId": "equipment-set-001-uwb8is",
      "setOrder": 2,
      "sourceSection": "3.1.1",
      "sourceSectionTitleKo": "고검의 잔향",
      "level": 70,
      "rarity": 5,
      "partId": "kit",
      "partLabelKo": "부품",
      "defense": {
        "statKo": "방어력",
        "value": "+21"
      },
      "options": [
        {
          "slot": 1,
          "categoryId": "equipment-option-004-by8x8u"
        },
        {
          "slot": 2,
          "categoryId": "equipment-option-005-tuvl3"
        },
        {
          "slot": 3,
          "categoryId": "equipment-option-003-1n541rj"
        }
      ],
      "forgeable": true,
      "crafting": {
        "materialPartCategoryId": null,
        "sourceStatus": "placeholder",
        "notes": "소모량은 원문에서 확인되지 않아 부품 카테고리 row만 생성함."
      },
      "sourceRefs": [
        "namu-equipment-main"
      ],
      "verification": {
        "status": "needs_review",
        "notes": "원문에서 일차 수집한 값. 추후 인게임/공식 데이터로 교차 검수 필요."
      }
    },
    {
      "id": "equipment-003-kpqqgn",
      "sortOrder": 3,
      "names": {
        "ko": "고검의 잔향 금속 장갑"
      },
      "group": "set",
      "setCategoryId": "equipment-set-001-uwb8is",
      "setOrder": 3,
      "sourceSection": "3.1.1",
      "sourceSectionTitleKo": "고검의 잔향",
      "level": 70,
      "rarity": 5,
      "partId": "gloves",
      "partLabelKo": "보호 장갑",
      "defense": {
        "statKo": "방어력",
        "value": "+42"
      },
      "options": [
        {
          "slot": 1,
          "categoryId": "equipment-option-006-33c0nm"
        },
        {
          "slot": 2,
          "categoryId": "equipment-option-007-142alc9"
        },
        {
          "slot": 3,
          "categoryId": "equipment-option-008-r7bzch"
        }
      ],
      "forgeable": true,
      "crafting": {
        "materialPartCategoryId": null,
        "sourceStatus": "placeholder",
        "notes": "소모량은 원문에서 확인되지 않아 부품 카테고리 row만 생성함."
      },
      "sourceRefs": [
        "namu-equipment-main"
      ],
      "verification": {
        "status": "needs_review",
        "notes": "원문에서 일차 수집한 값. 추후 인게임/공식 데이터로 교차 검수 필요."
      }
    },
    {
      "id": "equipment-004-1le4udg",
      "sortOrder": 4,
      "names": {
        "ko": "고검의 잔향 금속 장갑 · I"
      },
      "group": "set",
      "setCategoryId": "equipment-set-001-uwb8is",
      "setOrder": 4,
      "sourceSection": "3.1.1",
      "sourceSectionTitleKo": "고검의 잔향",
      "level": 70,
      "rarity": 5,
      "partId": "gloves",
      "partLabelKo": "보호 장갑",
      "defense": {
        "statKo": "방어력",
        "value": "+42"
      },
      "options": [
        {
          "slot": 1,
          "categoryId": "equipment-option-009-czufpb"
        },
        {
          "slot": 2,
          "categoryId": "equipment-option-010-v0qnad"
        },
        {
          "slot": 3,
          "categoryId": "equipment-option-008-r7bzch"
        }
      ],
      "forgeable": true,
      "crafting": {
        "materialPartCategoryId": null,
        "sourceStatus": "placeholder",
        "notes": "소모량은 원문에서 확인되지 않아 부품 카테고리 row만 생성함."
      },
      "sourceRefs": [
        "namu-equipment-main"
      ],
      "verification": {
        "status": "needs_review",
        "notes": "원문에서 일차 수집한 값. 추후 인게임/공식 데이터로 교차 검수 필요."
      }
    },
    {
      "id": "equipment-005-8karo7",
      "sortOrder": 5,
      "names": {
        "ko": "고검의 잔향 장갑"
      },
      "group": "set",
      "setCategoryId": "equipment-set-001-uwb8is",
      "setOrder": 5,
      "sourceSection": "3.1.1",
      "sourceSectionTitleKo": "고검의 잔향",
      "level": 70,
      "rarity": 5,
      "partId": "armor",
      "partLabelKo": "방어구",
      "defense": {
        "statKo": "방어력",
        "value": "+56"
      },
      "options": [
        {
          "slot": 1,
          "categoryId": "equipment-option-011-t6hvju"
        },
        {
          "slot": 2,
          "categoryId": "equipment-option-012-3jxc2l"
        },
        {
          "slot": 3,
          "categoryId": "equipment-option-013-v3j27p"
        }
      ],
      "forgeable": true,
      "crafting": {
        "materialPartCategoryId": null,
        "sourceStatus": "placeholder",
        "notes": "소모량은 원문에서 확인되지 않아 부품 카테고리 row만 생성함."
      },
      "sourceRefs": [
        "namu-equipment-main"
      ],
      "verification": {
        "status": "needs_review",
        "notes": "원문에서 일차 수집한 값. 추후 인게임/공식 데이터로 교차 검수 필요."
      }
    },
    {
      "id": "equipment-006-4lamj4",
      "sortOrder": 6,
      "names": {
        "ko": "고검의 잔향 장갑 · I"
      },
      "group": "set",
      "setCategoryId": "equipment-set-001-uwb8is",
      "setOrder": 6,
      "sourceSection": "3.1.1",
      "sourceSectionTitleKo": "고검의 잔향",
      "level": 70,
      "rarity": 5,
      "partId": "armor",
      "partLabelKo": "방어구",
      "defense": {
        "statKo": "방어력",
        "value": "+56"
      },
      "options": [
        {
          "slot": 1,
          "categoryId": "equipment-option-014-ob03f5"
        },
        {
          "slot": 2,
          "categoryId": "equipment-option-015-1a1iypf"
        },
        {
          "slot": 3,
          "categoryId": "equipment-option-016-1wce5r2"
        }
      ],
      "forgeable": true,
      "crafting": {
        "materialPartCategoryId": null,
        "sourceStatus": "placeholder",
        "notes": "소모량은 원문에서 확인되지 않아 부품 카테고리 row만 생성함."
      },
      "sourceRefs": [
        "namu-equipment-main"
      ],
      "verification": {
        "status": "needs_review",
        "notes": "원문에서 일차 수집한 값. 추후 인게임/공식 데이터로 교차 검수 필요."
      }
    },
    {
      "id": "equipment-007-1fs7keu",
      "sortOrder": 7,
      "names": {
        "ko": "식양의 흐름 단봉"
      },
      "group": "set",
      "setCategoryId": "equipment-set-002-lpvg3a",
      "setOrder": 1,
      "sourceSection": "3.1.2",
      "sourceSectionTitleKo": "식양의 흐름",
      "level": 70,
      "rarity": 5,
      "partId": "kit",
      "partLabelKo": "부품",
      "defense": {
        "statKo": "방어력",
        "value": "+21"
      },
      "options": [
        {
          "slot": 1,
          "categoryId": "equipment-option-017-6d3nnd"
        },
        {
          "slot": 2,
          "categoryId": "equipment-option-018-11knlso"
        },
        {
          "slot": 3,
          "categoryId": "equipment-option-019-alze4s"
        }
      ],
      "forgeable": true,
      "crafting": {
        "materialPartCategoryId": null,
        "sourceStatus": "placeholder",
        "notes": "소모량은 원문에서 확인되지 않아 부품 카테고리 row만 생성함."
      },
      "sourceRefs": [
        "namu-equipment-main"
      ],
      "verification": {
        "status": "needs_review",
        "notes": "원문에서 일차 수집한 값. 추후 인게임/공식 데이터로 교차 검수 필요."
      }
    },
    {
      "id": "equipment-008-10sg346",
      "sortOrder": 8,
      "names": {
        "ko": "식양의 흐름 보호 장갑"
      },
      "group": "set",
      "setCategoryId": "equipment-set-002-lpvg3a",
      "setOrder": 2,
      "sourceSection": "3.1.2",
      "sourceSectionTitleKo": "식양의 흐름",
      "level": 70,
      "rarity": 5,
      "partId": "gloves",
      "partLabelKo": "보호 장갑",
      "defense": {
        "statKo": "방어력",
        "value": "+42"
      },
      "options": [
        {
          "slot": 1,
          "categoryId": "equipment-option-020-ng1tpw"
        },
        {
          "slot": 2,
          "categoryId": "equipment-option-021-1nhizku"
        },
        {
          "slot": 3,
          "categoryId": "equipment-option-022-1r6hojt"
        }
      ],
      "forgeable": true,
      "crafting": {
        "materialPartCategoryId": null,
        "sourceStatus": "placeholder",
        "notes": "소모량은 원문에서 확인되지 않아 부품 카테고리 row만 생성함."
      },
      "sourceRefs": [
        "namu-equipment-main"
      ],
      "verification": {
        "status": "needs_review",
        "notes": "원문에서 일차 수집한 값. 추후 인게임/공식 데이터로 교차 검수 필요."
      }
    },
    {
      "id": "equipment-009-a74ocy",
      "sortOrder": 9,
      "names": {
        "ko": "식양의 흐름 경갑"
      },
      "group": "set",
      "setCategoryId": "equipment-set-002-lpvg3a",
      "setOrder": 3,